[
 {
  "school": "princeton",
  "pi": "Parastoo Abtahi",
  "a": [
   "member_cs_structure_40fd2684af44eff1152d",
   "Mohamed Kari"
  ],
  "b": [
   "ext:princeton:mo-kari",
   "Mo Kari"
  ],
  "verdict": "same_person",
  "canonical_name": "Mohamed Kari",
  "reason": "Mo Kari is the short form Mohamed Kari uses himself: his homepage mkari.de is titled 'Mo Kari' and its body names him 'Mohamed Kari', a former Presidential Postdoctoral Fellow at Princeton CS. Abtahi's own site lists 'Mohamed Kari' as her coauthor and 'Mo Kari' among team alumni. Note: he was a postdoc, not a student.",
  "evidence": [
   {
    "url": "https://mkari.de/",
    "quote": "<title>Mo Kari</title>",
    "observed": "Homepage title uses the short form.",
    "sha256": "2f491f1760c5315b145ac7e3f6d40675934308772014005cfab42704be53ee29",
    "fetched_at": "2026-10-28T18:29:54+00:00",
    "status": 200,
    "capture_db": "/n/fs/resemble/homogenizing-science/code/hierarchy/chain-research-20261028/same-name-tools/captures.sqlite"
   },
   {
    "url": "https://mkari.de/",
    "quote": "Mohamed Kari Scholar Resume I am a research scientist at FieldAI 's humanoid Research Institute in Cambridge, MA",
    "observed": "Same homepage gives the full name.",
    "sha256": "2f491f1760c5315b145ac7e3f6d40675934308772014005cfab42704be53ee29",
    "fetched_at": "2026-10-28T18:29:54+00:00",
    "status": 200,
    "capture_db": "/n/fs/resemble/homogenizing-science/code/hierarchy/chain-research-20261028/same-name-tools/captures.sqlite"
   },
   {
    "url": "https://mkari.de/",
    "quote": "Prior to joining FieldAI, I was a Presidential Postdoctoral Research Fellow at Princeton Computer Science where I worked on situated interactions for user-colocated robots.",
    "observed": "Ties the person to Princeton CS (Abtahi's area).",
    "sha256": "2f491f1760c5315b145ac7e3f6d40675934308772014005cfab42704be53ee29",
    "fetched_at": "2026-10-28T18:29:54+00:00",
    "status": 200,
    "capture_db": "/n/fs/resemble/homogenizing-science/code/hierarchy/chain-research-20261028/same-name-tools/captures.sqlite"
   },
   {
    "url": "https://parastooabtahi.com/",
    "quote": "Reality Promises: Virtual-Physical Decoupling Illusions in Mixed Reality via Invisible Mobile Robots Mohamed Kari, Parastoo Abtahi UIST 2025",
    "observed": "PI's site uses the full name for her coauthor.",
    "sha256": "95b5c1e359d8de084ddd7624a75551dd635e4b3467beba90ec839ef9cb03d878",
    "fetched_at": "2026-10-28T18:29:47+00:00",
    "status": 200,
    "capture_db": "/n/fs/resemble/homogenizing-science/code/hierarchy/chain-research-20261028/same-name-tools/captures.sqlite"
   },
   {
    "url": "https://parastooabtahi.com/team",
    "quote": "Alumni Pradnesh Thoppay Michael Huang Joseph Rupertus Mo Kari",
    "observed": "PI's team page lists the short form among alumni.",
    "sha256": "8f8f3d7b452145bd833366cf28b11da57ba42a6e4b431b1dd04e3c88ed0457b1",
    "fetched_at": "2026-10-28T18:29:19+00:00",
    "status": 200,
    "capture_db": "/n/fs/resemble/homogenizing-science/code/hierarchy/chain-research-20261028/same-name-tools/captures.sqlite"
   },
   {
    "url": "https://api.openalex.org/works?filter=author.id:A5019735734&per-page=50&select=id,display_name,publication_year,authorships",
    "quote": "SplatXR: A Toolkit for Multi-Layered Extended Reality via On-Headset 3D Gaussian Splatting",
    "observed": "One OpenAlex author (A5019735734, 'Mohamed Kari', Princeton 2026; Duisburg-Essen earlier) coauthors SplatXR with Abtahi.",
    "sha256": "b38de598fa91529d4bf9a1d2ed65d794f75cf1bd13e3d7cf7d39a0334d7c1670",
    "fetched_at": "2026-10-28T18:29:39+00:00",
    "status": 200,
    "capture_db": "/n/fs/resemble/homogenizing-science/code/hierarchy/chain-research-20261028/same-name-tools/captures.sqlite"
   }
  ]
 },
 {
  "school": "cmu",
  "pi": "Martial Hebert",
  "a": [
   "cmu_person_7df9d05472762d323782",
   "Yu-Xiang Wang"
  ],
  "b": [
   "cmu_person_98f56bd98711b3ea32e1",
   "Yuxiong Wang"
  ],
  "verdict": "different_people",
  "canonical_name": null,
  "reason": "Two different CMU PhDs. Yu-Xiang Wang got a joint ML/Statistics PhD (CMU-ML-17-105, Dec 2017) with a committee of Tibshirani, Fienberg, Lei, Smola and Smith, and no Hebert. Yuxiong (Yu-Xiong) Wang defended an RI thesis in May 2018 with Martial Hebert as chair. The Yu-Xiang Wang record looks wrongly attached to Hebert's lab, probably a name-match spillover from Yuxiong Wang.",
  "evidence": [
   {
    "url": "http://reports-archive.adm.cs.cmu.edu/anon/ml2017/abstracts/17-105.html",
    "quote": "CMU-ML-17-105 New Paradigms and Optimality Guarantees in Statistical Learning and Estimation Yu-Xiang Wang December 2017 Ph.D. Thesis Joint Machine Learning Department",
    "observed": "Yu-Xiang Wang: ML/Statistics PhD thesis, 2017.",
    "sha256": "850a34c977c162d3d9a5dcbb46ab17a048bca7d7069d2d02c463ec3c0182d3b0",
    "fetched_at": "2026-10-28T18:30:32+00:00",
    "status": 200,
    "capture_db": "/n/fs/resemble/homogenizing-science/code/hierarchy/chain-research-20261028/same-name-tools/captures.sqlite"
   },
   {
    "url": "http://reports-archive.adm.cs.cmu.edu/anon/ml2017/abstracts/17-105.html",
    "quote": "Thesis Committee: Ryan J. Tibshirani (Chair) Stephen E. Fienberg Jing Lei Alexander J. Smola Adam D. Smith (Boston University)",
    "observed": "Hebert is not on Yu-Xiang Wang's committee.",
    "sha256": "850a34c977c162d3d9a5dcbb46ab17a048bca7d7069d2d02c463ec3c0182d3b0",
    "fetched_at": "2026-10-28T18:30:32+00:00",
    "status": 200,
    "capture_db": "/n/fs/resemble/homogenizing-science/code/hierarchy/chain-research-20261028/same-name-tools/captures.sqlite"
   },
   {
    "url": "https://www.ri.cmu.edu/event/learning-to-learn-for-small-sample-visual-recognition/",
    "quote": "PhD Thesis Defense May 8 Tue Yuxiong Wang Robotics Institute, Carnegie Mellon University",
    "observed": "Yuxiong Wang: RI PhD defense, 2018.",
    "sha256": "c0d244f9562296da823bf619cfc7a47b2410cf8ef8372d281b5038bf69d6cd98",
    "fetched_at": "2026-10-28T18:30:35+00:00",
    "status": 200,
    "capture_db": "/n/fs/resemble/homogenizing-science/code/hierarchy/chain-research-20261028/same-name-tools/captures.sqlite"
   },
   {
    "url": "https://www.ri.cmu.edu/event/learning-to-learn-for-small-sample-visual-recognition/",
    "quote": "Thesis Committee Members : Martial Hebert, Chair Deva Ramanan Ruslan Salakhutdinov Andrew Zisserman, University of Oxford",
    "observed": "Hebert chairs Yuxiong Wang's committee.",
    "sha256": "c0d244f9562296da823bf619cfc7a47b2410cf8ef8372d281b5038bf69d6cd98",
    "fetched_at": "2026-10-28T18:30:35+00:00",
    "status": 200,
    "capture_db": "/n/fs/resemble/homogenizing-science/code/hierarchy/chain-research-20261028/same-name-tools/captures.sqlite"
   },
   {
    "url": "https://www.ri.cmu.edu/wp-json/people/v1/get_programs",
    "sha256": "aff64ed6a47cb7c80fdbb270b983ec757ddc63d6bbdaf9b286a97150f3afcd82",
    "from_input": true,
    "quote": "\"name\": \"Yuxiong Wang\", \"slug\": \"yuxiong-wang\", \"status\": \"publish\", \"programIndex\": 0, \"program\": \"phd\", \"matriculation\": \"08/20/2012\", \"completed\": true, \"completionDate\": \"05/20/2018\", \"advisers\": [{\"name\": \"Martial Hebert\"",
    "observed": "From the input record (not re-fetched): RI program record, PhD 2012-2018, adviser Hebert."
   }
  ]
 },
 {
  "school": "cmu",
  "pi": "Eric Nyberg",
  "a": [
   "cmu_person_source_99a96c9f94cf3567ab97",
   "Xinyue Chen"
  ],
  "b": [
   "cmu_person_source_b38e5595369acec258a4",
   "Xi Chen"
  ],
  "verdict": "different_people",
  "canonical_name": null,
  "reason": "The April 2021 LTI directory lists Xi Chen, Xiaoyi Chen and Xinyue Chen as three separate MCDS entries under Nyberg, each with a different Andrew email ID. Xinyue Chen is still listed in 2022 with the same ID. They are three classmates, not one person under name variants.",
  "evidence": [
   {
    "url": "https://web.archive.org/web/20210417204836id_/https://lti.cs.cmu.edu/directory/students/current/c",
    "quote": "Academic Advisor: Eric Nyberg Xi Chen Program: Master of Science in Computational Data Science Email:",
    "observed": "2021 LTI directory: 'Xi Chen' is its own entry (MCDS, adviser Nyberg) with its own Andrew email ID (not reproduced here).",
    "sha256": "4582af74f9cbb7b907b7fda5baadb0b4ab8f9985c9b9609fcc4ab4594e7e1da9",
    "fetched_at": "2026-10-28T18:30:58+00:00",
    "status": 200,
    "capture_db": "/n/fs/resemble/homogenizing-science/code/hierarchy/chain-research-20261028/same-name-tools/captures.sqlite"
   },
   {
    "url": "https://web.archive.org/web/20210417204836id_/https://lti.cs.cmu.edu/directory/students/current/c",
    "quote": "Academic Advisor: Eric Nyberg Xiaoyi Chen Program: Master of Science in Computational Data Science Email:",
    "observed": "Same 2021 page: 'Xiaoyi Chen' is a separate entry right after Xi Chen, with a different Andrew email ID.",
    "sha256": "4582af74f9cbb7b907b7fda5baadb0b4ab8f9985c9b9609fcc4ab4594e7e1da9",
    "fetched_at": "2026-10-28T18:30:58+00:00",
    "status": 200,
    "capture_db": "/n/fs/resemble/homogenizing-science/code/hierarchy/chain-research-20261028/same-name-tools/captures.sqlite"
   },
   {
    "url": "https://web.archive.org/web/20210417204836id_/https://lti.cs.cmu.edu/directory/students/current/c",
    "quote": "Academic Advisor: Eric Nyberg Xinyue Chen Program: Master of Science in Computational Data Science Email:",
    "observed": "Same 2021 page: 'Xinyue Chen' is a third separate entry with a different Andrew email ID.",
    "sha256": "4582af74f9cbb7b907b7fda5baadb0b4ab8f9985c9b9609fcc4ab4594e7e1da9",
    "fetched_at": "2026-10-28T18:30:58+00:00",
    "status": 200,
    "capture_db": "/n/fs/resemble/homogenizing-science/code/hierarchy/chain-research-20261028/same-name-tools/captures.sqlite"
   },
   {
    "url": "https://web.archive.org/web/20221001172450id_/https://lti.cs.cmu.edu/directory/students/current/all?page=3",